[
  {
    "regex_start": "^\\[INFO\\]",
    "msg_type": "Info",
    "msg_nr_of_lines": 5,
    "use_regex_stop": false,
    "regex_stop": ""
  },
  {
    "regex_start": "^\\[ERROR\\]",
    "msg_type": "Error",
    "msg_nr_of_lines": 1,
    "use_regex_stop": false,
    "regex_stop": ""
  },
  {
    "regex_start": "^\\[DEBUG\\]",
    "msg_type": "Debug",
    "msg_nr_of_lines": 1,
    "use_regex_stop": false,
    "regex_stop": ""
  },
  {
    "regex_start": "^\\[WARNING\\]",
    "msg_type": "Warning",
    "msg_nr_of_lines": 0,
    "use_regex_stop": true,
    "regex_stop": "^---+$"
  },
  {
    "regex_start": "^\\[TRACE\\]",
    "msg_type": "Debug",
    "msg_nr_of_lines": 0,
    "use_regex_stop": true,
    "regex_stop": "^END_OF_TRACE$"
  }
]
